{
  "preferences": {
    "flavor_principles": [
      "Ποτέ κανέλα/ζάχαρη σε αλμυρά πιάτα",
      "Παραδοσιακό ελληνικό λαδερό στυλ",
      "Ακριβείς μετρήσεις και θερμοκρασίες",
      "Αμφισβητεί παραδοχές — ρωτάει γιατί πριν ακολουθήσει",
      "Προσαρμόζει συνταγές με βάση ό,τι έχει διαθέσιμο αντί να αγοράζει καινούρια"
    ],
    "favorite_ingredients": [
      "φέτα",
      "σκόρδο",
      "ελαιόλαδο",
      "τρούφα"
    ],
    "disliked_ingredients": [
      "κανέλα σε αλμυρά",
      "ζάχαρη σε αλμυρά"
    ],
    "flavor_affinities": [
      {
        "combination": [
          "σπανακόρυζο",
          "τηγανητό αυγό",
          "φέτα"
        ],
        "notes": "Υποχρεωτικό combo — σπας τον κρόκο πάνω στο ρύζι"
      },
      {
        "combination": [
          "φακές",
          "ξύδι",
          "φέτα"
        ],
        "notes": "Κλασικό ζευγάρι"
      },
      {
        "combination": [
          "φασολάκια λαδερά",
          "φέτα",
          "ψωμί"
        ],
        "notes": "Κλασική ελληνική λαδερή τριάδα"
      }
    ],
    "cooking_style": [
      "Μεθοδικός",
      "Θέλει ακριβείς χρόνους και θερμοκρασίες",
      "Δεν ακολουθεί τυφλά — ρωτάει γιατί",
      "Προτιμάει απλές συνταγές με λίγα υλικά"
    ],
    "spice_tolerance": "medium"
  },
  "dietary": {
    "pattern": "Intermittent fasting",
    "goals": [
      "Calorie-conscious",
      "High protein",
      "Active lifestyle — calisthenics"
    ],
    "restrictions": []
  },
  "cooking_log": [],
  "updated_at": "2026-02-14T19:14:27.575Z"
}